<?xml version="1.0" encoding="UTF-8"?>
<c:participants xmlns:c="http://lifelinetasmania.org.au/chats" xmlns:xsi="http://www.w3.org/2001/XMLSchema-instance" xsi:schemaLocation="http://lifelinetasmania.org.au/chats chats.xsd ">
  <c:participant>
    <c:person>
      <c:firstname>c:firstname</c:firstname>
      <c:surname>c:surname</c:surname>
      <c:dateOfBirth>2001-01-01</c:dateOfBirth>
      <c:sex>MALE</c:sex>
    </c:person>
    <c:volunteer>
      <c:person>
        <c:firstname>c:firstname</c:firstname>
        <c:surname>c:surname</c:surname>
        <c:dateOfBirth>2001-01-01</c:dateOfBirth>
        <c:sex>MALE</c:sex>
      </c:person>
    </c:volunteer>
    <c:status>
      <c:name>c:name</c:name>
    </c:status>
    <c:mobility>c:mobility</c:mobility>
    <c:clientNote>
      <c:name>c:name</c:name>
    </c:clientNote>
    <c:disability>
      <c:name>c:name</c:name>
    </c:disability>
    <c:callAllocation>
      <c:name>c:name</c:name>
    </c:callAllocation>
    <c:limitingHealthIssues>c:limitingHealthIssues</c:limitingHealthIssues>
    <c:otherLimitingFactors>c:otherLimitingFactors</c:otherLimitingFactors>
    <c:driversLicence>c:driversLicence</c:driversLicence>
    <c:drivingAbility>c:drivingAbility</c:drivingAbility>
    <c:drivingConfidence>c:drivingConfidence</c:drivingConfidence>
    <c:placeOfOrigin>c:placeOfOrigin</c:placeOfOrigin>
    <c:yearOfSettlement>0</c:yearOfSettlement>
    <c:closeRelatives>c:closeRelatives</c:closeRelatives>
    <c:closeRlFrCount>0</c:closeRlFrCount>
    <c:proximityOfRelatives>c:proximityOfRelatives</c:proximityOfRelatives>
    <c:proximityOfFriends>c:proximityOfFriends</c:proximityOfFriends>
    <c:involvementGC>c:involvementGC</c:involvementGC>
    <c:involvementIH>c:involvementIH</c:involvementIH>
    <c:lifeStory>c:lifeStory</c:lifeStory>
    <c:lifeExperiences>c:lifeExperiences</c:lifeExperiences>
    <c:hobbies>c:hobbies</c:hobbies>
    <c:interests>c:interests</c:interests>
    <c:loneliness>c:loneliness</c:loneliness>
    <c:consentToProvideDetails>true</c:consentToProvideDetails>
    <c:consentedForFutureContacts>true</c:consentedForFutureContacts>
    <c:hasCarer>true</c:hasCarer>
    <c:countryOfBirth>
      <c:name>c:name</c:name>
    </c:countryOfBirth>
    <c:languageSpokenAtHome>
      <c:name>c:name</c:name>
    </c:languageSpokenAtHome>
    <c:aboriginalOrTorresStraitIslanderOrigin>true</c:aboriginalOrTorresStraitIslanderOrigin>
    <c:accommodationType>c:accommodationType</c:accommodationType>
    <c:dvaCardStatus>c:dvaCardStatus</c:dvaCardStatus>
    <c:householdComposition>c:householdComposition</c:householdComposition>
    <c:disabled>true</c:disabled>
    <c:age>0</c:age>
    <c:sex>c:sex</c:sex>
    <c:homePhoneNumber>c:homePhoneNumber</c:homePhoneNumber>
    <c:mobilePhoneNumber>c:mobilePhoneNumber</c:mobilePhoneNumber>
    <c:streetAddress>c:streetAddress</c:streetAddress>
    <c:mailAddress>c:mailAddress</c:mailAddress>
    <c:emailAddress>c:emailAddress</c:emailAddress>
  </c:participant>
</c:participants>
