<?xml version="1.0" encoding="UTF-8"?>
<c:activities xmlns:c="http://lifelinetasmania.org.au/chats" xmlns:xsi="http://www.w3.org/2001/XMLSchema-instance" xsi:schemaLocation="http://lifelinetasmania.org.au/chats chats.xsd ">
	<c:activity>
		<c:name>c:name1</c:name>
		<c:codeName>c:codeName1</c:codeName>
		<c:description>c:description</c:description>
		<c:start>2001-12-31T12:00:00</c:start>
		<c:end>2001-12-31T12:30:00</c:end>
		<c:region>SOUTH</c:region>
		<c:attendance>
			<c:participant>
				<c:person>
					<c:firstname>c:firstname</c:firstname>
					<c:surname>c:surname1</c:surname>
					<c:dateOfBirth>2001-01-01</c:dateOfBirth>
					<c:sex>MALE</c:sex>
					<c:region>SOUTH</c:region>
				</c:person>
			</c:participant>
			<c:arrivingTransportType>c:arrivingTransportType</c:arrivingTransportType>
			<c:departingTransportType>c:departingTransportType</c:departingTransportType>
		</c:attendance>
		<c:attendance>
			<c:participant>
				<c:person>
					<c:firstname>c:firstname</c:firstname>
					<c:surname>c:surname2</c:surname>
					<c:dateOfBirth>2001-01-01</c:dateOfBirth>
					<c:sex>MALE</c:sex>
					<c:region>SOUTH</c:region>
				</c:person>
			</c:participant>
			<c:arrivingTransportType>c:arrivingTransportType</c:arrivingTransportType>
			<c:departingTransportType>c:departingTransportType</c:departingTransportType>
		</c:attendance>
		<c:attendance>
			<c:participant>
				<c:person>
					<c:firstname>c:firstname</c:firstname>
					<c:surname>c:surname3</c:surname>
					<c:dateOfBirth>2001-01-01</c:dateOfBirth>
					<c:sex>MALE</c:sex>
					<c:region>SOUTH</c:region>
				</c:person>
			</c:participant>
			<c:arrivingTransportType>c:arrivingTransportType</c:arrivingTransportType>
			<c:departingTransportType>c:departingTransportType</c:departingTransportType>
		</c:attendance>
		<c:volunteeredTime>
			<c:volunteer>
				<c:person>
					<c:firstname>c:firstname</c:firstname>
					<c:surname>c:surname</c:surname>
					<c:dateOfBirth>2001-01-01</c:dateOfBirth>
					<c:sex>MALE</c:sex>
					<c:region>NORTH</c:region>
				</c:person>
			</c:volunteer>
			<c:start>2001-12-31T12:00:00</c:start>
			<c:end>2001-12-31T12:10:00</c:end>
		</c:volunteeredTime>
		<c:volunteeredTime>
			<c:volunteer>
				<c:person>
					<c:firstname>c:firstname</c:firstname>
					<c:surname>c:surname</c:surname>
					<c:dateOfBirth>2001-01-01</c:dateOfBirth>
					<c:sex>MALE</c:sex>
					<c:region>NORTH</c:region>
				</c:person>
			</c:volunteer>
			<c:start>2001-12-31T12:00:00</c:start>
			<c:end>2001-12-31T12:10:00</c:end>
		</c:volunteeredTime>
		<c:volunteeredTime>
			<c:volunteer>
				<c:person>
					<c:firstname>c:firstname</c:firstname>
					<c:surname>c:surname</c:surname>
					<c:dateOfBirth>2001-01-01</c:dateOfBirth>
					<c:sex>MALE</c:sex>
					<c:region>NORTH</c:region>
				</c:person>
			</c:volunteer>
			<c:start>2001-12-31T12:00:00</c:start>
			<c:end>2001-12-31T12:10:00</c:end>
		</c:volunteeredTime>
	</c:activity>
	<c:activity>
		<c:name>c:name2</c:name>
		<c:codeName>c:codeName2</c:codeName>
		<c:description>c:description</c:description>
		<c:start>2001-12-15T12:00:00</c:start>
		<c:end>2001-12-15T13:00:00</c:end>
		<c:region>SOUTH</c:region>
		<c:attendance>
			<c:participant>
				<c:person>
					<c:firstname>c:firstname</c:firstname>
					<c:surname>c:surname1</c:surname>
					<c:dateOfBirth>2001-01-01</c:dateOfBirth>
					<c:sex>MALE</c:sex>
					<c:region>SOUTH</c:region>
				</c:person>
			</c:participant>
			<c:arrivingTransportType>c:arrivingTransportType</c:arrivingTransportType>
			<c:departingTransportType>c:departingTransportType</c:departingTransportType>
		</c:attendance>
		<c:attendance>
			<c:participant>
				<c:person>
					<c:firstname>c:firstname</c:firstname>
					<c:surname>c:surname2</c:surname>
					<c:dateOfBirth>2001-01-01</c:dateOfBirth>
					<c:sex>MALE</c:sex>
					<c:region>SOUTH</c:region>
				</c:person>
			</c:participant>
			<c:arrivingTransportType>c:arrivingTransportType</c:arrivingTransportType>
			<c:departingTransportType>c:departingTransportType</c:departingTransportType>
		</c:attendance>
		<c:attendance>
			<c:participant>
				<c:person>
					<c:firstname>c:firstname</c:firstname>
					<c:surname>c:surname3</c:surname>
					<c:dateOfBirth>2001-01-01</c:dateOfBirth>
					<c:sex>MALE</c:sex>
					<c:region>SOUTH</c:region>
				</c:person>
			</c:participant>
			<c:arrivingTransportType>c:arrivingTransportType</c:arrivingTransportType>
			<c:departingTransportType>c:departingTransportType</c:departingTransportType>
		</c:attendance>
		<c:volunteeredTime>
			<c:volunteer>
				<c:person>
					<c:firstname>c:firstname</c:firstname>
					<c:surname>c:surname</c:surname>
					<c:dateOfBirth>2001-01-01</c:dateOfBirth>
					<c:sex>MALE</c:sex>
					<c:region>NORTH</c:region>
				</c:person>
			</c:volunteer>
			<c:start>2001-12-31T12:00:00</c:start>
			<c:end>2001-12-31T12:10:00</c:end>
		</c:volunteeredTime>
		<c:volunteeredTime>
			<c:volunteer>
				<c:person>
					<c:firstname>c:firstname</c:firstname>
					<c:surname>c:surname</c:surname>
					<c:dateOfBirth>2001-01-01</c:dateOfBirth>
					<c:sex>MALE</c:sex>
					<c:region>NORTH</c:region>
				</c:person>
			</c:volunteer>
			<c:start>2001-12-31T12:00:00</c:start>
			<c:end>2001-12-31T12:10:00</c:end>
		</c:volunteeredTime>
		<c:volunteeredTime>
			<c:volunteer>
				<c:person>
					<c:firstname>c:firstname</c:firstname>
					<c:surname>c:surname</c:surname>
					<c:dateOfBirth>2001-01-01</c:dateOfBirth>
					<c:sex>MALE</c:sex>
					<c:region>NORTH</c:region>
				</c:person>
			</c:volunteer>
			<c:start>2001-12-31T12:00:00</c:start>
			<c:end>2001-12-31T12:10:00</c:end>
		</c:volunteeredTime>
	</c:activity>
</c:activities>
