<?xml version="1.0" encoding="UTF-8"?>
<c:volunteers xmlns:c="http://lifelinetasmania.org.au/chats" xmlns:xsi="http://www.w3.org/2001/XMLSchema-instance" xsi:schemaLocation="http://lifelinetasmania.org.au/chats chats.xsd ">
  <c:volunteer>
    <c:person>
      <c:firstname>c:firstname</c:firstname>
      <c:surname>c:surname</c:surname>
      <c:dateOfBirth>2001-01-01</c:dateOfBirth>
      <c:sex>MALE</c:sex>
    </c:person>
    <c:callAllocation>
      <c:participant>
        <c:person>
          <c:firstname>c:firstname</c:firstname>
          <c:surname>c:surname</c:surname>
          <c:dateOfBirth>2001-01-01</c:dateOfBirth>
          <c:sex>MALE</c:sex>
        </c:person>
        <c:status>ACTIVE</c:status>
        <c:clientNote>c:clientNote</c:clientNote>
        <c:disability>c:disability</c:disability>
        <c:mobility>c:mobility</c:mobility>
        <c:limitingHealthIssues>c:limitingHealthIssues</c:limitingHealthIssues>
        <c:otherLimitingFactors>c:otherLimitingFactors</c:otherLimitingFactors>
        <c:driversLicence>c:driversLicence</c:driversLicence>
        <c:drivingAbility>c:drivingAbility</c:drivingAbility>
        <c:drivingConfidence>c:drivingConfidence</c:drivingConfidence>
        <c:placeOfOrigin>c:placeOfOrigin</c:placeOfOrigin>
        <c:yearOfSettlement>0</c:yearOfSettlement>
        <c:closeRelatives>c:closeRelatives</c:closeRelatives>
        <c:closeRlFrCount>0</c:closeRlFrCount>
        <c:proximityOfRelatives>c:proximityOfRelatives</c:proximityOfRelatives>
        <c:proximityOfFriends>c:proximityOfFriends</c:proximityOfFriends>
        <c:involvementGC>c:involvementGC</c:involvementGC>
        <c:involvementIH>c:involvementIH</c:involvementIH>
        <c:lifeStory>c:lifeStory</c:lifeStory>
        <c:lifeExperiences>c:lifeExperiences</c:lifeExperiences>
        <c:hobbies>c:hobbies</c:hobbies>
        <c:interests>c:interests</c:interests>
        <c:loneliness>c:loneliness</c:loneliness>
        <c:consentToProvideDetails>true</c:consentToProvideDetails>
        <c:consentedForFutureContacts>true</c:consentedForFutureContacts>
        <c:hasCarer>true</c:hasCarer>
        <c:countryOfBirth>c:countryOfBirth</c:countryOfBirth>
        <c:languageSpokenAtHome>c:languageSpokenAtHome</c:languageSpokenAtHome>
        <c:aboriginalOrTorresStraitIslanderOrigin>c:aboriginalOrTorresStraitIslanderOrigin</c:aboriginalOrTorresStraitIslanderOrigin>
        <c:accommodationType>c:accommodationType</c:accommodationType>
        <c:dvaCardStatus>c:dvaCardStatus</c:dvaCardStatus>
        <c:householdComposition>c:householdComposition</c:householdComposition>
      </c:participant>
    </c:callAllocation>
    <c:call>
      <c:participant>
        <c:person>
          <c:firstname>c:firstname</c:firstname>
          <c:surname>c:surname</c:surname>
          <c:dateOfBirth>2001-01-01</c:dateOfBirth>
          <c:sex>MALE</c:sex>
        </c:person>
        <c:status>ACTIVE</c:status>
        <c:clientNote>c:clientNote</c:clientNote>
        <c:disability>c:disability</c:disability>
        <c:mobility>c:mobility</c:mobility>
        <c:limitingHealthIssues>c:limitingHealthIssues</c:limitingHealthIssues>
        <c:otherLimitingFactors>c:otherLimitingFactors</c:otherLimitingFactors>
        <c:driversLicence>c:driversLicence</c:driversLicence>
        <c:drivingAbility>c:drivingAbility</c:drivingAbility>
        <c:drivingConfidence>c:drivingConfidence</c:drivingConfidence>
        <c:placeOfOrigin>c:placeOfOrigin</c:placeOfOrigin>
        <c:yearOfSettlement>0</c:yearOfSettlement>
        <c:closeRelatives>c:closeRelatives</c:closeRelatives>
        <c:closeRlFrCount>0</c:closeRlFrCount>
        <c:proximityOfRelatives>c:proximityOfRelatives</c:proximityOfRelatives>
        <c:proximityOfFriends>c:proximityOfFriends</c:proximityOfFriends>
        <c:involvementGC>c:involvementGC</c:involvementGC>
        <c:involvementIH>c:involvementIH</c:involvementIH>
        <c:lifeStory>c:lifeStory</c:lifeStory>
        <c:lifeExperiences>c:lifeExperiences</c:lifeExperiences>
        <c:hobbies>c:hobbies</c:hobbies>
        <c:interests>c:interests</c:interests>
        <c:loneliness>c:loneliness</c:loneliness>
        <c:consentToProvideDetails>true</c:consentToProvideDetails>
        <c:consentedForFutureContacts>true</c:consentedForFutureContacts>
        <c:hasCarer>true</c:hasCarer>
        <c:countryOfBirth>c:countryOfBirth</c:countryOfBirth>
        <c:languageSpokenAtHome>c:languageSpokenAtHome</c:languageSpokenAtHome>
        <c:aboriginalOrTorresStraitIslanderOrigin>c:aboriginalOrTorresStraitIslanderOrigin</c:aboriginalOrTorresStraitIslanderOrigin>
        <c:accommodationType>c:accommodationType</c:accommodationType>
        <c:dvaCardStatus>c:dvaCardStatus</c:dvaCardStatus>
        <c:householdComposition>c:householdComposition</c:householdComposition>
      </c:participant>
      <c:start>2001-12-31T12:00:00</c:start>
      <c:end>2001-12-31T12:00:00</c:end>
      <c:notes>c:notes</c:notes>
    </c:call>
  </c:volunteer>
</c:volunteers>
