<?xml version="1.0" encoding="UTF-8"?>
<c:activities xmlns:c="http://lifelinetasmania.org.au/chats" xmlns:xsi="http://www.w3.org/2001/XMLSchema-instance" xsi:schemaLocation="http://lifelinetasmania.org.au/chats chats.xsd ">
	<c:activity>
		<c:name>c:name</c:name>
		<c:codeName>c:codeName</c:codeName>
		<c:description>c:description</c:description>
		<c:start>2001-12-31T12:00:00</c:start>
		<c:end>2001-12-31T12:00:00</c:end>
		<c:region>SOUTH</c:region>
		<c:participation>
			<c:participant>
				<c:person>
					<c:firstname>c:firstname</c:firstname>
					<c:surname>c:surname1</c:surname>
					<c:dateOfBirth>2001-01-01</c:dateOfBirth>
					<c:sex>MALE</c:sex>
					<c:region>SOUTH</c:region>
				</c:person>
			</c:participant>
		</c:participation>
		<c:waitListed>
			<c:person>
				<c:firstname>c:firstname</c:firstname>
				<c:surname>c:surname2</c:surname>
				<c:dateOfBirth>2001-01-01</c:dateOfBirth>
				<c:sex>MALE</c:sex>
				<c:region>SOUTH</c:region>
			</c:person>
		</c:waitListed>
		<c:attendance>
			<c:participant>
				<c:person>
					<c:firstname>c:firstname</c:firstname>
					<c:surname>c:surname3</c:surname>
					<c:dateOfBirth>2001-01-01</c:dateOfBirth>
					<c:sex>MALE</c:sex>
					<c:region>SOUTH</c:region>
				</c:person>
			</c:participant>
		</c:attendance>
	</c:activity>
</c:activities>
