<?xml version="1.0" encoding="UTF-8"?>
<c:participants xmlns:c="http://lifelinetasmania.org.au/chats" xmlns:xsi="http://www.w3.org/2001/XMLSchema-instance" xsi:schemaLocation="http://lifelinetasmania.org.au/chats chats.xsd ">
  <c:participant>
    <c:person>
      <c:firstname>c:firstname</c:firstname>
      <c:surname>c:surname</c:surname>
      <c:dateOfBirth>2001-01-01</c:dateOfBirth>
      <c:sex>MALE</c:sex>
    </c:person>
    <c:status>ACTIVE</c:status>
    <c:mobility>c:mobility</c:mobility>
    <c:clientNote>c:clientNote</c:clientNote>
    <c:disability>Intellectual learning</c:disability>
    <c:limitingHealthIssues>c:limitingHealthIssues</c:limitingHealthIssues>
    <c:otherLimitingFactors>c:otherLimitingFactors</c:otherLimitingFactors>
    <c:driversLicence>c:driversLicence</c:driversLicence>
    <c:drivingAbility>c:drivingAbility</c:drivingAbility>
    <c:drivingConfidence>c:drivingConfidence</c:drivingConfidence>
    <c:placeOfOrigin>c:placeOfOrigin</c:placeOfOrigin>
    <c:yearOfSettlement>100</c:yearOfSettlement>
    <c:closeRelatives>c:closeRelatives</c:closeRelatives>
    <c:closeRlFrCount>10</c:closeRlFrCount>
    <c:proximityOfRelatives>c:proximityOfRelatives</c:proximityOfRelatives>
    <c:proximityOfFriends>c:proximityOfFriends</c:proximityOfFriends>
    <c:involvementGC>c:involvementGC</c:involvementGC>
    <c:involvementIH>c:involvementIH</c:involvementIH>
    <c:lifeStory>c:lifeStory</c:lifeStory>
    <c:lifeExperiences>c:lifeExperiences</c:lifeExperiences>
    <c:hobbies>c:hobbies</c:hobbies>
    <c:interests>c:interests</c:interests>
    <c:loneliness>c:loneliness</c:loneliness>
    <c:consentToProvideDetails>true</c:consentToProvideDetails>
    <c:consentedForFutureContacts>true</c:consentedForFutureContacts>
    <c:hasCarer>true</c:hasCarer>
    <c:countryOfBirth>Australia</c:countryOfBirth>
    <c:languageSpokenAtHome>English</c:languageSpokenAtHome>
    <c:aboriginalOrTorresStraitIslanderOrigin>Aboriginal</c:aboriginalOrTorresStraitIslanderOrigin>
    <c:accommodationType>Private residence - client or family owned/purchasing</c:accommodationType>
    <c:dvaCardStatus>DVA Gold Card</c:dvaCardStatus>
    <c:householdComposition>Couple with dependant(s)</c:householdComposition>
  </c:participant>
</c:participants>
